### ISSUE TITLE
플러그 버전 1.01.34 연결 문의 (리눅스 호스트에서 서버 구동 후 연결문의)

### ISSUE THREAD

**Issue by djjproject** [SeongSikChae/PowerManagerServer#6]
안녕하세요? 그룹방에서도 문의 드렸습니다만, 도통 해결되지 않아 문의 드립니다.

일단 설치 방식은 아래와 같은 방법을 이용했습니다.
https://blog.djjproject.com/798

설치 과정중에 DNS 리버스 쿼리가 잘못된것을 알아 수정한 다음 리버스 쿼리도 잘 되는 상황입니다.
`C:\Users\USER\Downloads\Win64-v1.0.1>nslookup 192.168.0.100 192.168.0.100
서버:    dawonai.com
Address:  192.168.0.100

이름:    dwmqtt.dawonai.com
Address:  192.168.0.100

C:\Users\USER\Downloads\Win64-v1.0.1>nslookup dawonai.com 192.168.0.100
서버:    dwapi.dawonai.com
Address:  192.168.0.100

이름:    dawonai.com
Address:  192.168.0.100
`

하위 공유기 DNS 설정은 아래와 같습니다.
![image](https://user-images.githubusercontent.com/9498953/170462981-2993309d-6d64-4050-ba8d-c1963e0553aa.png)

플러그 등록 관련 PowerMangerConfig 내용입니다.
`C:\Users\USER\Downloads\Win64-v1.0.1>PowerManagerConfig.exe --host 192.168.244.1 --port 5000 --api_server_addr https://192.168.0.100:18443 --web_server_addr https://192.168.0.100 --clientCertificate D:\PowerManager\Certificate\newcerts\C.p12 --clientCertificatePassword 1q2w3e4r
Common.Logging Revision: 362ee1b0
Common.Core Revision: 362ee1b0
PowerManagerConfig Revision: b4e6864bㅣㄴ

[::ffff:192.168.244.1]:5000 Connected
Mode V1 (B540 <= v1.01.26) or V2 (B540 == v1.01.28) or V3 (B540 == v1.01.30) or V4 (B550) (default V1): V3
[DUT->PC] START_OK:2ef432510027#
SSID: PowerManager
Wifi Password: 1q2w3e4r
UserId: djj9404@gmail.com/google
Model: B540_W
Mqtt Topic: dwd
Push: {"mac":"2ef432510027","api_server_addr":"dwapi.dawonai.com","api_server_port":"18443","server_addr":"dwmqtt.dawonai.com","server_port":"8883","ssl_support":"yes","ssid":"PowerManager","pass":"1q2w3e4r","user_id":"djj9404@gmail.com/google","company":"DAWONDNS","model":"B540_W","lati":"37.6523018","long":"127.0622559","topic":"dwd"}
Send: 333 Byte.
{"mac":"2ef432510027","respone":"OK"}
37
{"mac":"2ef432510027","respone":"OK"}
네트워크를 정상화 시킨 후 Enter를 입력하세요.
verify: zgL=XgqycCN2PdjAPNSTNPjayMW7t==RhcFuPcrOq6FJ mqtt_key: 130VondXHTS9rpPq
{"statusCode":1,"code":null,"message":null}`

이떄 PowerManagerServer / Api 의 로그는 아래와 같습니다.
[api_server.log](https://github.com/SeongSikChae/PowerManagerServer/files/8778163/api_server.log)
[server.log](https://github.com/SeongSikChae/PowerManagerServer/files/8778164/server.log)

몇일째 재시도 해보고 있기는 하나 잘 안되네요.

실제로 PowerManager 의 이름을 가진 와이파이에 15초가량 접속했다가 끊어집니다.

감사합니다.

**Comment by djjproject** [comment]
윈도우에서 구동하니 정상적으로 동작하네요. 이유를 모르겠습니다.

ApiServer 로그에 아래 단계가 추가되어 Server 쪽에 AuthFail 메시지가 나오는것을 확인했습니다.

2022-05-26 22:17:39,535 [INFO ] [PowerManagerApiServer.RequestLoggingMiddleware] [Microsoft.Extensions.Logging.Logger.<Log>g__LoggerLog|12_0:0] 192.168.0.119:5300 => 192.168.0.119:18443 PUT /api/auth/add 200 {"user_id":"djj9404@gmail.com/google","device_id":"2ef432510027","verify":"zgL=XgqycCN2PdjAPNSTNPjayMW7t==RhcFuPcrOq6FJ","mqtt_key":"130VondXHTS9rpPq"}
2022-05-26 22:17:39,535 [INFO ] [Microsoft.AspNetCore.Hosting.Diagnostics] [Microsoft.Extensions.Logging.Logger.<Log>g__LoggerLog|12_0:0] Request finished HTTP/1.1 PUT https://192.168.0.119:18443/api/auth/add application/json;+charset=utf-8 151 - 200 - application/json;+charset=utf-8 108.6208ms
2022-05-26 22:17:43,386 [INFO ] [Microsoft.AspNetCore.Hosting.Diagnostics] [Microsoft.Extensions.Logging.Logger.<Log>g__LoggerLog|12_0:0] Request starting HTTP/1.1 POST https://dwapi.dawonai.com/api/v1/devices/register/create application/json 180
2022-05-26 22:17:43,387 [INFO ] [Microsoft.AspNetCore.Routing.EndpointMiddleware] [Microsoft.Extensions.Logging.Logger.<Log>g__LoggerLog|12_0:0] Executing endpoint 'PowerManagerApiServer.Controllers.ApiController.Create (PowerManagerApiServer)'
2022-05-26 22:17:43,387 [INFO ] [Microsoft.AspNetCore.Mvc.Infrastructure.ControllerActionInvoker] [Microsoft.Extensions.Logging.Logger.<Log>g__LoggerLog|12_0:0] Route matched with {action = "Create", controller = "Api"}. Executing controller action with signature System.Threading.Tasks.Task`1[PowerManagerApiServer.Controllers.ApiController+CreateResponse] Create(CreateRequest) on controller PowerManagerApiServer.Controllers.ApiController (PowerManagerApiServer).

**Comment by SeongSikChae** [comment]
100번서버에 tcpdump 등으로 패킷을 떠서 플러그가 서버로 패킷을 보내는지 확인해보시고 안되면 플러그가 제대로 dns 정보를 받지 못한것일 수 도 있습니다.

**Comment by SeongSikChae** [comment]
Start.sh가 아니라 run
Sh로 혹시 실행하셨나요?

**Comment by djjproject** [comment]
안녕하세요.

192.168.0.17 : 리눅스 서버
192.168.0.100 : 리눅스 서버 위의 컨테이너 입니다.

192.168.0.119 : 윈도우 컴퓨터인데요.

리눅스 서버에서 구동할 때에는
서버와 DNS서버 모두 192.168.0.100 에서 운영하였습니다.

윈도우에서 잠시 테스트 해볼  때에는
인증서를 새로 생성하고 리눅스에 올라가 있는 DNS서버의 dawonai.com 쿼리를 192.168.0.119 로만 수정하여 진행했습니다.

cd /PowerManager
./start.sh
cd /PowerManagerApi
./start.sh
cd ~
/etc/init.d/bind9 start

이렇게 실행하였습니다.

tcpdump 로도 한번 확인해보겠습니다.

감사합니다.

**Comment by djjproject** [comment]
tcpdump 확인하니

하위 공유기 192.168.0.159 에서 연결을 시도하는 것 같습니다만, 추가적으로 어떻게 확인해봐야할지 잘 모르겠습니다.
root@powermanager:~# tcpdump -i eth0 src 192.168.0.159
tcpdump: verbose output suppressed, use -v or -vv for full protocol decode
listening on eth0, link-type EN10MB (Ethernet), capture size 262144 bytes
01:42:17.574283 ARP, Request who-has powermanager.local tell 192.168.0.159, length 46
01:42:17.577675 IP 192.168.0.159.4096 > powermanager.local.domain: 1178+ A? dwapi.dawonai.com. (35)
01:42:17.593663 IP 192.168.0.159.10347 > powermanager.local.18443: Flags [S], seq 6644, win 5840, options [mss 1460], length 0
01:42:17.604123 IP 192.168.0.159.10347 > powermanager.local.18443: Flags [P.], seq 6645:6729, ack 2243208234, win 5840, length 84
01:42:17.620341 IP 192.168.0.159.10347 > powermanager.local.18443: Flags [F.], seq 84, ack 8, win 5833, length 0
01:42:17.620398 IP 192.168.0.159.10347 > powermanager.local.18443: Flags [.], ack 9, win 5832, length 0
01:42:22.721038 ARP, Reply 192.168.0.159 is-at 72:5d:cc:05:ba:02 (oui Unknown), length 46

이 이후로 또 15초 이후에 하위 공유기에서 연결이 떨어집니다.

**Comment by djjproject** [comment]
조금 상세하게 아래와 같습니다.
이상하게 checksum error 항목이 있는것 같네요..
--> 이부분은 tx rx 오프로드 옵션 부분인것 같습니다. 별 문제 있는 부분은 아닌것 같습니다.

root@powermanager:~# tcpdump -i eth0 host 192.168.0.159 -X -vv
tcpdump: listening on eth0, link-type EN10MB (Ethernet), capture size 262144 bytes
01:57:24.044139 ARP, Ethernet (len 6), IPv4 (len 4), Request who-has powermanager.local tell 192.168.0.159, length 46
        0x0000:  0001 0800 0604 0001 725d cc05 ba02 c0a8  ........r]......
        0x0010:  009f 0000 0000 0000 c0a8 0064 e2b6 b079  ...........d...y
        0x0020:  7c28 dd93 4751 f465 0000 0fac 0401       |(..GQ.e......
01:57:24.044162 ARP, Ethernet (len 6), IPv4 (len 4), Reply powermanager.local is-at 52:ad:c9:e5:6b:8c (oui Unknown), length 28
        0x0000:  0001 0800 0604 0002 52ad c9e5 6b8c c0a8  ........R...k...
        0x0010:  0064 725d cc05 ba02 c0a8 009f            .dr]........
01:57:24.046224 IP (tos 0x0, ttl 127, id 236, offset 0, flags [none], proto UDP (17), length 63)
    192.168.0.159.4096 > powermanager.local.domain: [udp sum ok] 18349+ A? dwapi.dawonai.com. (35)
        0x0000:  4500 003f 00ec 0000 7f11 b86e c0a8 009f  E..?.......n....
        0x0010:  c0a8 0064 1000 0035 002b 88ae 47ad 0100  ...d...5.+..G...
        0x0020:  0001 0000 0000 0000 0564 7761 7069 0764  .........dwapi.d
        0x0030:  6177 6f6e 6169 0363 6f6d 0000 0100 01    awonai.com.....
01:57:24.046498 IP (tos 0x0, ttl 64, id 43592, offset 0, flags [none], proto UDP (17), length 109)
    powermanager.local.domain > 192.168.0.159.4096: [bad udp cksum 0x82be -> 0x10d8!] 18349*- q: A? dwapi.dawonai.com. 1/1/1 dwapi.dawonai.com. A 192.168.0.100 ns: dawonai.com. NS dawonai.com. ar: dawonai.com. A 192.168.0.100 (81)
        0x0000:  4500 006d aa48 0000 4011 4de4 c0a8 0064  E..m.H..@.M....d
        0x0010:  c0a8 009f 0035 1000 0059 82be 47ad 8500  .....5...Y..G...
        0x0020:  0001 0001 0001 0001 0564 7761 7069 0764  .........dwapi.d
        0x0030:  6177 6f6e 6169 0363 6f6d 0000 0100 01c0  awonai.com......
        0x0040:  0c00 0100 0100 0151 8000 04c0 a800 64c0  .......Q......d.
        0x0050:  1200 0200 0100 0151 8000 02c0 12c0 1200  .......Q........
        0x0060:  0100 0100 0151 8000 04c0 a800 64         .....Q......d
01:57:24.062315 IP (tos 0x0, ttl 127, id 237, offset 0, flags [none], proto TCP (6), length 44)
    192.168.0.159.9359 > powermanager.local.18443: Flags [S], cksum 0x7878 (correct), seq 6640, win 5840, options [mss 1460], length 0
        0x0000:  4500 002c 00ed 0000 7f06 b88b c0a8 009f  E..,............
        0x0010:  c0a8 0064 248f 480b 0000 19f0 0000 0000  ...d$.H.........
        0x0020:  6002 16d0 7878 0000 0204 05b4 cf48       `...xx.......H
01:57:24.062379 IP (tos 0x0, ttl 64, id 0, offset 0, flags [DF], proto TCP (6), length 44)
    powermanager.local.18443 > 192.168.0.159.9359: Flags [S.], cksum 0x8272 (incorrect -> 0xd6dc), seq 1611291999, ack 6641, win 64240, options [mss 1460], length 0
        0x0000:  4500 002c 0000 4000 4006 b878 c0a8 0064  E..,..@.@..x...d
        0x0010:  c0a8 009f 480b 248f 600a 5d5f 0000 19f1  ....H.$.`.]_....
        0x0020:  6012 faf0 8272 0000 0204 05b4            `....r......
01:57:24.071603 IP (tos 0x0, ttl 127, id 238, offset 0, flags [none], proto TCP (6), length 124)
    192.168.0.159.9359 > powermanager.local.18443: Flags [P.], cksum 0xb757 (correct), seq 1:85, ack 1, win 5840, length 84
        0x0000:  4500 007c 00ee 0000 7f06 b83a c0a8 009f  E..|.......:....
        0x0010:  c0a8 0064 248f 480b 0000 19f1 600a 5d60  ...d$.H.....`.]`
        0x0020:  5018 16d0 b757 0000 1603 0100 4f01 0000  P....W......O...
        0x0030:  4b03 036d 726b d9cc fad1 40b2 9423 381e  K..mrk....@..#8.
        0x0040:  d4ff 16e7 e19d f3ab 8d94 a48a cd1e 7df5  ..............}.
        0x0050:  3f73 7b00 0012 003d 0035 003c 002f 00b7  ?s{....=.5.<./..
        0x0060:  0095 00b6 0094 00ff 0100 0010 000d 000c  ................
        0x0070:  000a 0601 0501 0401 0301 0201            ............
01:57:24.080485 IP (tos 0x0, ttl 127, id 239, offset 0, flags [none], proto TCP (6), length 40)
    192.168.0.159.9359 > powermanager.local.18443: Flags [F.], cksum 0xd265 (correct), seq 85, ack 8, win 5833, length 0
        0x0000:  4500 0028 00ef 0000 7f06 b88d c0a8 009f  E..(............
        0x0010:  c0a8 0064 248f 480b 0000 1a45 600a 5d67  ...d$.H....E`.]g
        0x0020:  5011 16c9 d265 0000 67a5 95c2 95fe       P....e..g.....
01:57:24.082224 IP (tos 0x0, ttl 64, id 181, offset 0, flags [DF], proto TCP (6), length 40)
    powermanager.local.18443 > 192.168.0.159.9359: Flags [F.], cksum 0x826e (incorrect -> 0xee91), seq 8, ack 86, win 64155, length 0
        0x0000:  4500 0028 00b5 4000 4006 b7c7 c0a8 0064  E..(..@.@......d
        0x0010:  c0a8 009f 480b 248f 600a 5d67 0000 1a46  ....H.$.`.]g...F
        0x0020:  5011 fa9b 826e 0000                      P....n..
01:57:24.088165 IP (tos 0x0, ttl 127, id 240, offset 0, flags [none], proto TCP (6), length 40)
    192.168.0.159.9359 > powermanager.local.18443: Flags [.], cksum 0xd265 (correct), seq 86, ack 9, win 5832, length 0
        0x0000:  4500 0028 00f0 0000 7f06 b88c c0a8 009f  E..(............
        0x0010:  c0a8 0064 248f 480b 0000 1a46 600a 5d68  ...d$.H....F`.]h
        0x0020:  5010 16c8 d265 0000 9da1 f754 ea5b       P....e.....T.[
01:57:29.218815 ARP, Ethernet (len 6), IPv4 (len 4), Request who-has 192.168.0.159 tell powermanager.local, length 28
        0x0000:  0001 0800 0604 0001 52ad c9e5 6b8c c0a8  ........R...k...
        0x0010:  0064 0000 0000 0000 c0a8 009f            .d..........
01:57:29.221004 ARP, Ethernet (len 6), IPv4 (len 4), Reply 192.168.0.159 is-at 72:5d:cc:05:ba:02 (oui Unknown), length 46
        0x0000:  0001 0800 0604 0002 725d cc05 ba02 c0a8  ........r]......
        0x0010:  009f 52ad c9e5 6b8c c0a8 0064 709e 466e  ..R...k....dp.Fn
        0x0020:  e222 b475 384c 33fb 0301 01ff ffff       .".u8L3.......

**Comment by SeongSikChae** [comment]
캡처를 잘못 했습니다
원인파악을 할려면 2가지 유형의 패킷이 정상적으로 오는지 확인해야하는데

서버단에서 udp 패킷중 dns 쿼리 패킷을 캡처를 해서 기기가 정상적으로 사설 dns서버에 요청을 하는지 확인해보고

그 다음 서버단에 api서버 포트를 목적지로 해서 tcp 패킷을 잡아다가 기기가 api서버로 rest api로 connect 요청을 하는지 확인해야합니다.

**Comment by djjproject** [comment]
안녕하세요. 일단 이전 코멘트 내용에 보시면 192.168.0.159 에서 192.168.0.100으로의 정상적인 쿼리 응답과
18443 에 대한 S P N 패킷들이 있습니다.

DNS 쿼리에 대해 문제가 없다고 판단이 되는 부분이
DNS 서버 위치는 그대로 두고 bind9 설정만 192.168.0.100 에서 192.168.0.119 윈도우쪽으로 돌려서 윈도우에서 Server/Api 를 구동했을 때에는 문제가 없습니다.

도저히 이 상황이 이해가 되지 않아서...
인증서도 윈도우에서 생성해서 테스트했고, 물론 이 생성 방법으로 윈도우에서 구동했을 때에는 문제가 없는 상황입니다.

혹시 @SeongSikChae 님, 리눅스에서 운영할 때, CentOS 몇 버전에서 운영하시나요? 최대한 베리언트를 줄여봐야할 것 같습니다. 이유를 도통 알 수가 없어서.. 만약에 윈도우에 잠시 운영했을 때 동일하게 안된다면 다른 문제를 의심해볼 수 있는데 윈도우에서는 잘 동작하니 너무 애매한 상황입니다.

오늘은 아무래도 단독 리눅스 머신에 따로 올려서 테스트 해봐야겠습니다. J1900 보드가 남는것이 있는데 거기에 운영을 해봐야겠습니다. 특히 환경을 맞추기 위해 CentOS 버전을 알려주시면 그걸 설치해서 해보겠습니다.

만약에 동작이 정상이면, 아래의 환경에서 모두 동작이 되지 않았습니다.
1. 데비안 10 X86 호스트
2. 우분투 18.04 docker 컨테이너
3. 데비안 11 lxc 컨테이너
4. 우분투 20.04 QEMU 가상머신

만약에 제 서버의 네트워크 설정이 이상해서 안될 수 있어서 다른 머신을 구해서 네이티브로 다시 한번 체크해볼 계획입니다.
--> 이게 만약에 된다면 제 서버가 조금 이상하다고 판단할 수 밖에 없는 것 같습니다.

서버는 INTEL NUC J5005, Proxmox 6.2 (Debian 10) 을 사용중에 있습니다.
(다수의 다른 서비스들이 구동되고 있습니다.)
https://blog.djjproject.com/714

확인하여 코멘트 남기겠습니다. 감사합니다.

**Comment by SeongSikChae** [comment]
CentOS 8.3 이요

그리고 제가 dns를 패킷을 확인하라는건 nslookup을 무조건 신뢰하면 안되기 때문입니다.

플러그를 설정하는 pc야 dns도 원하는데로 설정하고 캐시 플러시도 쉽지만

플러그는 온전히 dhcp로 부터 상속받는 구조기 때문에 설정과 다를 수 있기 때문에 패킷이 실제로 오는지를 먼저 봐야한다고 한겁니다.

**Comment by SeongSikChae** [comment]
이후 Issue가 더 이상 진행되고 있지 않으므로 Closed
